campus,formato,sigla,nombre_x,creditos,escuela_id
Casa Central,Presencial,COM103,Test de Actualidad II a,0,13
Casa Central,Presencial,COM105,Test de Actualidad III a,0,13
Casa Central,Presencial,COM109,Historia de la Comunicación Social,10,13
San Joaquín,Presencial,COM109,Historia de la Comunicación Social,10,13
Casa Central,Presencial,COM110,Teoría de la Comunicación Social,10,13
San Joaquín,Presencial,COM110,Teoría de la Comunicación Social,10,13
Casa Central,Presencial,COM111,Oratoria,10,13
Casa Central,Presencial,COM113,Tecnologías de la Comunicación,10,13
Casa Central,Presencial,COM115,Lenguaje Visual,10,13
San Joaquín,Presencial,COM115,Lenguaje Visual,10,13
Casa Central,Presencial,COM116,Audiencias,10,13
Casa Central,Presencial,COM117,Narracion Interactiva,10,13
Casa Central,Remoto,COM117,Narracion Interactiva,10,13
Casa Central,Presencial,COM120,Narración de No Ficción,10,13
San Joaquín,Presencial,COM120,Narración de No Ficción,10,13
Casa Central,Presencial,COM121,Semiología,10,13
San Joaquín,Presencial,COM121,Semiología,10,13
Casa Central,Presencial,COM122,Narración de Ficción,10,13
San Joaquín,Presencial,COM122,Narración de Ficción,10,13
Casa Central,Presencial,COM150,Laboratorio Agencia de Publicidad,10,13
Casa Central,Presencial,COM152,Laboratorio de Creación Audiovisual,10,13
Casa Central,Presencial,COM153,Laboratorio de Producción Ejecutiva,10,13
Casa Central,Remoto con Act.Presencial,COM155,Laboratorio de Escucha,10,13
Casa Central,Remoto,COM156,Laboratorio de Distribución Audiovisual,10,13
Casa Central,Presencial,COM200,Ética de las Comunicaciones,10,13
Casa Central,Presencial,COM201,Narración Escrita de No Ficción,10,13
Casa Central,Presencial,COM203,Narración Audiovisual de No Ficción,10,13
Casa Central,Presencial,COM204,Teoría de la Noticia,10,13
Casa Central,Presencial,COM205,Teoría Democrática,10,13
Casa Central,Remoto con Act.Presencial,COM206,Taller de Periodismo en Prensa,10,13
Casa Central,Presencial,COM208,Narración Gráfica de No Ficción,10,13
Casa Central,Remoto con Act.Presencial,COM209,Taller de Periodismo Radial,10,13
Casa Central,Remoto con Act.Presencial,COM211,Taller de Periodismo Televisivo,10,13
Casa Central,Presencial,COM214,Análisis de la Actualidad Nacional,10,13
Casa Central,Presencial,COM215,Análisis de la Actualidad Internacional,10,13
Casa Central,Presencial,COM217,Narración Radial de No Ficción,10,13
Casa Central,Presencial,COM290,Práctica Profesional,0,13
Casa Central,Presencial,COM3500,Economía Política de las Comunicaciones,10,13
Casa Central,Presencial,COM3501,Seminario de Investigación,10,13
Casa Central,Presencial,COM3502,Análisis Comparado de Periodismo,10,13
Casa Central,Presencial,COM3503,Taller de Periodismo Avanzado,10,13
Casa Central,Remoto con Act.Presencial,COM3503,Taller de Periodismo Avanzado,10,13
Casa Central,Remoto,COM3504,Industria Audiovisual,10,13
Casa Central,Presencial,COM3505,"Audiovisual, Tv y Niños 0-6 Años",10,13
Casa Central,Presencial,COM400,Consumo y Tendencias Sociales,10,13
Casa Central,Híbrido,COM4001,Fundamentos y Teorías de Comunicación y Educación,10,13
Casa Central,Híbrido,COM4003,Medios Aplicados a la Educación,10,13
Casa Central,Híbrido,COM4004,Aprendizajes y Tics,10,13
Casa Central,Híbrido,COM4009,Audiencias y Recepción,10,13
Casa Central,Presencial,COM401,Marketing,10,13
Casa Central,Híbrido,COM4017,Educación a Distancia,10,13
Casa Central,Presencial,COM402,Comportamiento del Consumidor,10,13
Casa Central,Híbrido,COM4021,Metodología Aplicada,10,13
Casa Central,Híbrido,COM4022,Proyecto de Grado,20,13
Casa Central,Presencial,COM403,Comunicación y Persuasión,10,13
Casa Central,Presencial,COM404,Introducción a la Publicidad,10,13
Casa Central,Presencial,COM405,Marcas,10,13
Casa Central,Presencial,COM406,Narración Publicitaria,10,13
Casa Central,Presencial,COM407,Teoría de las Organizaciones y Comunicación,10,13
Casa Central,Presencial,COM410,Taller Investigación Aplicada a la Publicidad,10,13
Casa Central,Presencial,COM411,Taller Soluciones Publicitarias,10,13
Casa Central,Presencial,COM412,Taller de Realización Publicitaria,10,13
Casa Central,Presencial,COM413,Taller de Comunicación Digital,10,13
Casa Central,Presencial,COM414,Taller de Propuestas Integradas de Comunicación,10,13
Casa Central,Presencial,COM416,Dirección y Conceptualización Visual Publicitaria,10,13
Casa Central,Presencial,COM490,Práctica Profesional,0,13
Casa Central,Presencial,COM5001,Taller de Periodismo I,15,13
Casa Central,Remoto,COM5003,Proyecto de Grado,20,13
Casa Central,Presencial,COM5005,Seminario de Ética Periodística,10,13
Casa Central,Presencial,COM5009,Periodismo y Cultura,10,13
Casa Central,Remoto,COM5010,Procesamiento y Visualización de Datos en Periodismo,5,13
Casa Central,Remoto,COM5011,Formatos Multimedia en Periodismo,5,13
Casa Central,Presencial,COM5012,Análisis en Prensa,5,13
Casa Central,Presencial,COM5013,Edición en Prensa,5,13
Casa Central,Remoto,COM5015,Periodismo de Datos Económicos,5,13
Casa Central,Remoto,COM5016,Macroeconomía para Periodistas,5,13
Casa Central,Remoto,COM5017,Mercado Financiero para Periodistas,5,13
Casa Central,Remoto,COM5018,Periodismo de Empresas e Industrias,5,13
Casa Central,Presencial,COM504,Taller de Creatividad Publicitaria,10,13
Casa Central,Presencial,COM508,Marketing Social y Campañas,10,13
Casa Central,Presencial,COM600,Montaje,10,13
Casa Central,Híbrido,COM6000,Teoría de la Comunicación,5,13
Casa Central,Híbrido,COM6001,Teoría de las Organizaciones,5,13
Casa Central,Híbrido,COM6002,Análisis del Entorno,5,13
Casa Central,Híbrido,COM6003,Diseño y Pensamiento Estratégico,5,13
Casa Central,Híbrido,COM6004,Percepciones y Marcas,10,13
Casa Central,Híbrido,COM6005,Gestión Estratégica de la Comunicación y la Confianza,10,13
Casa Central,Híbrido,COM6006,Discurso Corporativo,10,13
Casa Central,Híbrido,COM6007,Proyecto de Grado,20,13
Casa Central,Remoto,COM6009,Comunicación en Situaciones de Crisis,10,13
Casa Central,Presencial,COM601,Dirección de Fotografía,10,13
Casa Central,Híbrido,COM6011,Coaching y Liderazgo,10,13
Casa Central,Remoto,COM6026,Marketing Digital para Un Entorno Comunicacional,5,13
Casa Central,Híbrido,COM6027,Nuevas Tendencias en Comunicación Estratégica,5,13
Casa Central,Remoto,COM6033,Marketing y Comunicación Externa en Instituciones Educacionales,5,13
Casa Central,Remoto,COM6034,Discurso Corporativo Educacional,5,13
Casa Central,Remoto,COM6035,Liderazgo Basado en la Comunicación y Participación: el Rol del Comunicador Interno en Instituciones,5,13
Casa Central,Remoto,COM6036,Gestión de Comunicación de Crisis en Instituciones Educacionales,5,13
Casa Central,Remoto,COM6037,Gestión de la Comunicación Política,5,13
Casa Central,Remoto,COM6038,Medios de Comunicación Política y Campañas Electorales,5,13
Casa Central,Remoto,COM6039,Escenario Normativo y Legislativo que Afecta a la Política y a los Partidos,5,13
Casa Central,Presencial,COM604,Analisis y Creacion de Escena,10,13
Casa Central,Remoto,COM6040,Diseño de Estrategia y Modelo de Intervención Política,5,13
Casa Central,Remoto,COM6041,Estrategias Comunicacionales 2.0: el Uso de Redes en Organizaciones,5,13
Casa Central,Remoto,COM6042,Redes Sociales en Distintos Ámbitos de la Comunicación,5,13
Casa Central,Remoto,COM6043,Marketing Digital y Su Aplicación en Comercio Electrónico,5,13
Casa Central,Remoto,COM6046,Diseño de Contenidos Digitales,5,13
Casa Central,Remoto,COM6047,Big Data Orientado a Contenidos,5,13
Casa Central,Híbrido,COM6052,Comunicación Efectiva y Conciente,5,13
Casa Central,Remoto,COM6057,Storytelling Digital para Marcas y Empresas,5,13
Casa Central,Remoto,COM6058,Consumidores del Siglo Xxi: Tendencias Sociales y Consumo en Escenarios Emergentes,5,13
Casa Central,Remoto,COM6059,Convergencia Digital,5,13
Casa Central,Remoto,COM6060,Planificación y Dirección Estratégica de las Comunicaciones de Marketing,5,13
Casa Central,Remoto,COM6061,Fundamentos de la Experiencia de Usuario (Ux),5,13
Casa Central,Remoto,COM6062,Comportamiento del Usuario en Entornos Digitales,5,13
Casa Central,Remoto,COM6063,Diseño y Gestión de Experiencia de Usuario (Ux) en Procesos de Transformación Digital,5,13
Casa Central,Remoto,COM6064,Estudios de Usabilidad y Experiencia de Usuario (Ux),5,13
Casa Central,Presencial,COM6067,Taller de Proyectos Audiovisuales,10,13
Casa Central,Remoto,COM6069,Estrategias para Obtener Financiamiento Con Plataformas de Crowdfunding,5,13
Casa Central,Remoto,COM6070,Estrategias para Postular a Fondos Estatales para el Desarrollo de la Cultura,5,13
Casa Central,Presencial,COM6070,Estrategias para Postular a Fondos Estatales para el Desarrollo de la Cultura,5,13
Casa Central,Presencial,COM6073,Proceso de Gestión y Control de Proyectos Audiovisuales,5,13
Casa Central,Presencial,COM617,Lenguaje del Video Juego,10,13
Casa Central,Presencial,COM618,Metodologías de la Creatividad y la Innovación,10,13
Casa Central,Presencial,COM619,Taller de Producción Creativa,10,13
San Joaquín,Presencial,COM627,Claves del Cine Contemporáneo,10,13
Casa Central,Presencial,COM628,Cine Clásico,10,13
Casa Central,Presencial,COM704,Seminario de Cine,10,13
Casa Central,Presencial,COM705,Espectáculo Audiovisual,10,13
San Joaquín,Presencial,COM705,Espectáculo Audiovisual,10,13
Casa Central,Presencial,COM706,Herramientas de Gestion Audiovisual,10,13
Casa Central,Presencial,COM708,Fundamentos Dramaticos de Lo Audiovisual,10,13
Casa Central,Presencial,COM709,Generacion y Desarrollo de Proyectos Audiovisuales,10,13
Casa Central,Presencial,COM710,Taller de Television,10,13
Casa Central,Presencial,COM711,Seminario de Television,10,13
Casa Central,Presencial,COM712,Géneros y Formatos del Guión Audiovisual,10,13
Casa Central,Presencial,COM713,Taller de Documental,10,13
Casa Central,Presencial,COM714,Seminario de Nuevas Tendencias Audiovisuales,10,13
Casa Central,Presencial,COM715,Escritura del Relato Audiovisual,10,13
Casa Central,Presencial,COM716,Taller de Ficcion,10,13
Casa Central,Presencial,COM718,Taller de Lenguaje Audiovisual,10,13
Casa Central,Presencial,COM719,Taller de Realización Audiovisual,10,13
Casa Central,Presencial,COM720,Seminario de Documental,10,13
Casa Central,Presencial,COM721,Taller Avanzado de Realización,10,13
Casa Central,Presencial,COM790,Práctica Profesional I,0,13
Casa Central,Presencial,COM791,Práctica Profesional II,0,13
Casa Central,Remoto con Act.Presencial,COM8000,Metodología Avanzada para las Comunicaciones I,10,13
Casa Central,Remoto con Act.Presencial,COM8001,Seminario de Sistemas de Comunicación,10,13
Casa Central,Remoto con Act.Presencial,COM8004,Seminario Avanzado de Teorías de la Comunicación,10,13
Casa Central,Remoto con Act.Presencial,COM8006,Tesis I,40,13
Casa Central,Remoto con Act.Presencial,COM8007,Tesis II,40,13
Casa Central,Remoto con Act.Presencial,COM8008,Tesis III,40,13
Casa Central,Remoto con Act.Presencial,COM8009,Tesis IV,40,13
Casa Central,Presencial,COM801,Distribución y Marketing Audiovisual,5,13
Casa Central,Remoto con Act.Presencial,COM8012,Proyecto de Tesis,30,13
Casa Central,Remoto con Act.Presencial,COM8013,Examen de Candidatura,20,13
Casa Central,Presencial,COM8013,Examen de Candidatura,20,13
Casa Central,Remoto con Act.Presencial,COM8014,Actividad Anual de Seguimiento I,0,13
Casa Central,Remoto con Act.Presencial,COM8015,Actividad Anual de Seguimiento II,0,13
Casa Central,Remoto,COM8016,Autoría de Artículo Científico,0,13
Casa Central,Remoto con Act.Presencial,COM8016,Autoría de Artículo Científico,0,13
Casa Central,Remoto con Act.Presencial,COM8017,Pasantía,0,13
Casa Central,Remoto con Act.Presencial,COM8019,Seminario Doctoral de Investigación,5,13
Casa Central,Remoto,COM8024,"The Language(S) of Economy and Enterprises: Economic Discourses in Interplay With Discourses, Genres",5,13
Casa Central,Presencial,COM803,Comunicación Política,10,13
Casa Central,Presencial,COM809,Taller de Infografía,10,13
Casa Central,Presencial,COM813,Taller de Narración e Industria de Esports o Deportes Electrónicos,10,13
San Joaquín,Presencial,COM814,Cine Queer,10,13
Casa Central,Presencial,COM816,Desinformación y Verificación de Datos,10,13
Casa Central,Presencial,COM819,Taller de Prototipos Mediales,10,13
San Joaquín,Presencial,CCL2301,Taller de Gestión,10,14
San Joaquín,Presencial,CCL2302,Evaluación de Proyectos,10,14
San Joaquín,Presencial,CCL2321,Tecnología de Materiales,10,14
San Joaquín,Presencial,CCL2322,Anatomía de la Construcción,10,14
San Joaquín,Presencial,CCL2331,Análisis de Datos e Investigación,10,14
San Joaquín,Presencial,CCL2332,Topografía,10,14
San Joaquín,Presencial,CCL2341,Hidráulica General,10,14
San Joaquín,Presencial,CCL2342,Fundamentos para el Análisis Estructural,10,14
San Joaquín,Presencial,CCL2343,Tecnología del Hormigón,10,14
San Joaquín,Presencial,CCL2351,Sistemas y Procesos Constructivos,10,14
San Joaquín,Presencial,CCL2352,Comportamiento Estructural,10,14
San Joaquín,Presencial,CCL2353,Geotecnia,10,14
San Joaquín,Presencial,CCL2361,Instalaciones Sanitarias,10,14
San Joaquín,Presencial,CCL2362,Sustentabilidad en Construcción,10,14
San Joaquín,Presencial,CCL2363,Investigación de Operaciones,10,14
San Joaquín,Presencial,CCL2371,Sistemas y Procesos Constructivos Especiales,10,14
San Joaquín,Presencial,CCL2372,"Instalaciones de Gas, Clima y Electricidad",10,14
San Joaquín,Presencial,CCL2373,Administración y Finanzas,10,14
San Joaquín,Presencial,CCL2374,Administración de Obras,10,14
San Joaquín,Presencial,CCL2381,Estructura y Procesos,10,14
San Joaquín,Presencial,CCL2382,Gestión de Proyectos,10,14
San Joaquín,Presencial,CCL2383,Responsabilidad Social en Construcción,10,14
San Joaquín,Presencial,CCL2384,Emprendimiento y Habilidades Gerenciales,10,14
San Joaquín,Presencial,CCL2391,Residencia,30,14
San Joaquín,Presencial,CCL2411,Construcción y Su Entorno,10,14
San Joaquín,Presencial,CCL2412,Ciencia de los Materiales,10,14
San Joaquín,Presencial,CCL2413,Taller de Habilidades Académicas,5,14
San Joaquín,Presencial,CCO3320,Taller de Investigación en Construcción Civil,10,14
San Joaquín,Híbrido,CCO3803,Patologia de Obras de Construccion,10,14
San Joaquín,Híbrido,CCO3807,Liderazgo Efectivo y Sostenibilidad Empresarial,10,14
San Joaquín,Híbrido,CCO3808,Tecnologias de la Informacion para la Toma de Decisiones en Construccion,10,14
San Joaquín,Híbrido,CCO3809,Aspectos Criticos en la Gestion de Proyectos de Construccion,10,14
San Joaquín,Presencial,CCO3816,Sistemas Constructivos en Madera,10,14
San Joaquín,Presencial,CCO3822,Mecanica de Suelos Aplicada,10,14
San Joaquín,Híbrido,CCO3827,Acustica en la Edificacion,10,14
San Joaquín,Presencial,CCO3829,Gestión de Riesgos de Seguridad y Salud en el Trabajo,10,14
San Joaquín,Híbrido,CCO3830,Innovacion en Construccion,10,14
San Joaquín,Híbrido,CCO3834,Actividad Integradora de Graduación,30,14
San Joaquín,Híbrido,CCO3835,Construcción de Infraestructura Vial: Puentes y Túneles,10,14
San Joaquín,Híbrido,CCO3839,Industria Inmobiliaria,10,14
San Joaquín,Híbrido,CCO3840,Lean Project Delivery en Proyectos de Construcción,10,14
San Joaquín,Híbrido,CCO3842,Innovación e Industrialización en la Construcción,10,14
San Joaquín,Presencial,CCO3843,Innovación Social en Construcción,10,14
San Joaquín,Híbrido,CCO3843,Innovación Social en Construcción,10,14
San Joaquín,Híbrido,CCO3845,"Edificación, Salud y Medioambiente",10,14
San Joaquín,Híbrido,CCO3900,Herramientas de Análisis Físico de Edificios,10,14
San Joaquín,Híbrido,CCO3901,Desarrollo Sustentable,10,14
San Joaquín,Presencial,DPT5000,Acondicionamiento Fisico Con Pesas I,5,15
San Joaquín,Presencial,DPT5050,Entrenamiento Pesas Libres Halterofilia I,5,15
San Joaquín,Presencial,DPT5100,Atletismo I,5,15
San Joaquín,Presencial,DPT5200,Basquetbol I,5,15
San Joaquín,Presencial,DPT5205,Básquetbol Mujeres I,5,15
San Joaquín,Presencial,DPT5206,Básquetbol Hombres I,5,15
San Joaquín,Presencial,DPT5251,Básquetbol II,5,15
San Joaquín,Presencial,DPT5453,Fútbol I,5,15
San Joaquín,Presencial,DPT5454,Fútbol Mujeres I,5,15
San Joaquín,Presencial,DPT5502,Preparación Física y Recreación I,5,15
Oriente,Presencial,DPT5502,Preparación Física y Recreación I,5,15
San Joaquín,Presencial,DPT5705,Gimnasia Aeróbica I,5,15
San Joaquín,Presencial,DPT5755,Gimnasia Aeróbica Step I,5,15
San Joaquín,Presencial,DPT5806,Balonmano Mujeres I,5,15
San Joaquín,Presencial,DPT5807,Balonmano Hombres I,5,15
San Joaquín,Presencial,DPT5808,Balonmano I,5,15
San Joaquín,Presencial,DPT5901,Gimnasia Artistíca I,5,15
San Joaquín,Presencial,DPT6000,Judo I,5,15
San Joaquín,Presencial,DPT6051,Judo II,5,15
San Joaquín,Presencial,DPT6100,Judo Defensa Personal,5,15
San Joaquín,Presencial,DPT6150,Karate I,5,15
San Joaquín,Presencial,DPT6160,Tai-Chi,5,15
San Joaquín,Presencial,DPT6270,Escalada Deportiva Nivel I,5,15
San Joaquín,Presencial,DPT6300,Natación I,5,15
San Joaquín,Presencial,DPT6301,Natacion II,5,15
San Joaquín,Presencial,DPT6351,Hidrogimnasia,5,15
San Joaquín,Presencial,DPT6381,Fútbol Sala I,5,15
San Joaquín,Presencial,DPT6384,Fútbol Sala II,5,15
San Joaquín,Presencial,DPT6400,Rugby I,5,15
San Joaquín,Presencial,DPT6500,Tenis I,5,15
San Joaquín,Presencial,DPT6555,Tenis II,5,15
San Joaquín,Presencial,DPT6560,Tenis de Mesa I,5,15
San Joaquín,Presencial,DPT6700,Voleibol I,5,15
San Joaquín,Presencial,DPT6760,Vóleibol Playa I,5,15
San Joaquín,Presencial,DPT6805,Hockey Césped I,5,15
San Joaquín,Presencial,DPT6840,Danza Estilo Libre I,5,15
San Joaquín,Presencial,DPT6900,Ajedrez I,5,15
San Joaquín,Presencial,DPT7005,Selección de Ajedrez,5,15
San Joaquín,Presencial,DPT7055,Selección de Atletismo Mujeres,5,15
San Joaquín,Presencial,DPT7060,Selección de Atletismo Hombres,5,15
San Joaquín,Presencial,DPT7160,Selección de Básquetbol Muejeres,5,15
San Joaquín,Presencial,DPT7170,Selección de Básquetbol Hombres,5,15
San Joaquín,Presencial,DPT7260,Selección de Fútbol Mujeres,5,15
San Joaquín,Presencial,DPT7270,Selección de Fútbol Hombres,5,15
San Joaquín,Presencial,DPT7355,Selección de Balonmano Mujeres,5,15
San Joaquín,Presencial,DPT7360,Selección de Balonmano Hombres,5,15
San Joaquín,Presencial,DPT7375,Selección de Escalada Deportiva Hombres,5,15
San Joaquín,Presencial,DPT7380,Selección de Escalada Deportiva Mujeres,5,15
San Joaquín,Presencial,DPT7460,Selección de Judo Hombres,5,15
San Joaquín,Presencial,DPT7470,Selección de Judo Mujeres,5,15
San Joaquín,Presencial,DPT7525,Seleción de Karate Mujeres,5,15
San Joaquín,Presencial,DPT7535,Selección de Karate Hombres,5,15
San Joaquín,Presencial,DPT7665,Selección de Gimnasia Artística Mujeres,5,15
San Joaquín,Presencial,DPT7675,Selección de Gimnasia Artística Hombres,5,15
San Joaquín,Presencial,DPT7710,Selección de Gimansia Rítmica,5,15
San Joaquín,Presencial,DPT7815,Selección de Natación Mujeres,5,15
San Joaquín,Presencial,DPT7825,Selección de Natación Hombres,5,15
San Joaquín,Presencial,DPT7875,Selección de Tenis Hombres,5,15
San Joaquín,Presencial,DPT7885,Selección de Tenis Mujeres,5,15
San Joaquín,Presencial,DPT7915,Selección de Tenis de Mesa Mujeres,5,15
San Joaquín,Presencial,DPT7925,Selección de Tenis de Mesa Hombres,5,15
San Joaquín,Presencial,DPT7955,Selección de Vóleibol Hombres,5,15
San Joaquín,Presencial,DPT7960,Selección de Vóleibol Mujeres,5,15
San Joaquín,Presencial,DPT8025,Selección de Vóleibol Playa Mujeres,5,15
San Joaquín,Presencial,DPT8035,Selección de Vóleibol Playa Hombres,5,15
San Joaquín,Presencial,DPT8065,Selección de Rugby Mujeres,5,15
San Joaquín,Presencial,DPT8075,Selección de Rugby Hombres,5,15
San Joaquín,Presencial,DPT8110,Selección de Hockey Césped Mujeres,5,15
San Joaquín,Presencial,DPT8165,Selección de Cross Country Mujeres,5,15
San Joaquín,Presencial,DPT8175,Selección de Cross Country Hombres,5,15
San Joaquín,Presencial,DPT8310,Selección de Fútbol Sala Mujeres,5,15
San Joaquín,Presencial,DPT8315,Selección de Fútbol Sala Hombres,5,15
San Joaquín,Presencial,DPT8415,Selección de Halterofilia Mujeres,5,15
San Joaquín,Presencial,DPT8425,Selección de Halterofilia Hombres,5,15
Casa Central,Híbrido,DDE3016,La Garantia de Libertad de Expresión. Problemas Contemporaneos,10,16
Casa Central,Híbrido,DDE3130,Introducción a la Investigación Jurídica,20,16
Casa Central,Híbrido,DDE3134,Derecho de Daños,10,16
Casa Central,Híbrido,DDE3135,Responsabilidad Extracontractual del Empresario,10,16
Casa Central,Híbrido,DDE3138,Lex Et Imperium. el Poder y Su Organización Jurídica en la República Romana,10,16
Casa Central,Híbrido,DDE3140,Proyecto de Tesis Doctoral,40,16
Casa Central,Híbrido,DDE3142,Tesis Doctoral I,40,16
Casa Central,Híbrido,DDE3144,Tesis Doctoral III,40,16
Casa Central,Híbrido,DDE3145,Tesis Doctoral IV,40,16
Casa Central,Híbrido,DDE3148,Actividad Anual de Seguimiento I,0,16
Casa Central,Híbrido,DDE3149,Actividad Anual de Seguimiento II,0,16
Casa Central,Híbrido,DDE3150,Autoría o Artículo Científico,0,16
Casa Central,Híbrido,DDE3151,Pasantía,0,16
Casa Central,Híbrido,DDE3152,Teoría y Método del Derecho Comparado,10,16
Casa Central,Híbrido,DDE3153,Derecho e Inteligencia Artificial,10,16
Casa Central,Híbrido,DDE3154,Dos Tradiciones en la Historia del Derecho Subjetivo,10,16
Casa Central,Híbrido,DDE3155,"La Expropiación en el Derecho Internacional, Comparado y Chileno",10,16
Casa Central,Presencial,DEL318,Derecho de la Comunicación,10,16
Casa Central,Presencial,DER001C,Teoría del Acto Jurídico y Teoría de la Ley,10,16
Casa Central,Presencial,DER001F,Derecho Romano I,5,16
Casa Central,Presencial,DER001L,Instituciones del Estado de Derecho Chileno,10,16
Casa Central,Presencial,DER001N,Derecho Canónico,10,16
Casa Central,Presencial,DER001P,Derecho Penal Parte General I,10,16
Casa Central,Presencial,DER001R,Instituciones Procesales I,10,16
Casa Central,Presencial,DER001S,Derecho del Trabajo,10,16
Casa Central,Presencial,DER002C,Personas y Bienes,10,16
Casa Central,Presencial,DER002F,Derecho Romano II,10,16
Casa Central,Presencial,DER002L,Derecho Internacional Público,10,16
Casa Central,Presencial,DER002P,Derecho Penal Parte General II,10,16
Casa Central,Presencial,DER002R,Instituciones Procesales II,10,16
Casa Central,Presencial,DER003C,Obligaciones,10,16
Casa Central,Presencial,DER003F,Fundamentos Filosóficos del Derecho,10,16
Casa Central,Presencial,DER003L,Derechos Fundamentales y Derechos Humanos,10,16
Casa Central,Presencial,DER003P,Derecho Penal Parte Especial,10,16
Casa Central,Presencial,DER003R,Procedimientos Civiles I,10,16
Casa Central,Presencial,DER004C,Fuentes de Obligaciones I,10,16
Casa Central,Presencial,DER004F,Derecho Natural,10,16
Casa Central,Presencial,DER004L,Derecho Administrativo I,10,16
Casa Central,Presencial,DER004R,Procedimientos Civiles II,5,16
Casa Central,Presencial,DER005C,Fuentes de las Obligaciones II,5,16
Casa Central,Presencial,DER005F,Historia del Derecho,10,16
Casa Central,Presencial,DER005L,Derecho Administrativo II,10,16
Casa Central,Presencial,DER005R,Procedimientos Penales,10,16
Casa Central,Presencial,DER006C,Derecho de Familia,10,16
Casa Central,Presencial,DER006F,"Historia de las Instituciones Jurídicas, Políticas y Sociales Chilenas",10,16
Casa Central,Presencial,DER006L,Derecho Económico II,10,16
Casa Central,Presencial,DER007C,Derecho Sucesorio,10,16
Casa Central,Presencial,DER007F,Teoría y Fuentes del Derecho,5,16
Casa Central,Presencial,DER007L,Derecho Tributario I,10,16
Casa Central,Presencial,DER008C,El Comerciante y Bases de la Contratación Mercantil,10,16
Casa Central,Presencial,DER008F,Derecho Económico I,5,16
Casa Central,Presencial,DER008L,Derecho Tributario II,5,16
Casa Central,Presencial,DER009C,Derecho de Sociedades,10,16
Casa Central,Presencial,DER009F,Derecho Político,5,16
Casa Central,Presencial,DER010C,Financiamiento de la Empresa,10,16
Casa Central,Presencial,DER011C,Contratos Mercantiles y Concursos,10,16
Casa Central,Presencial,DER012C,Derecho Internacional Privado,5,16
Casa Central,Presencial,DER100H,Taller de Metodología de la Investigación,0,16
Casa Central,Presencial,DER102E,Sustentabilidad Corporativa y Relación Con las Comunidades,10,16
San Joaquín,Presencial,DER103E,Familia y Sociedad,10,16
San Joaquín,Presencial,DER104E,Debates Constitucionales,10,16
San Joaquín,Presencial,DER105E,Protección de Datos Personales en la Sociedad de la Información,10,16
San Joaquín,Presencial,DER106E,Esencia y Protección de los Derechos Humanos,10,16
San Joaquín,Presencial,DER107E,"Aguas en Chile: Uso, Gestión y Conflictos",10,16
Casa Central,Presencial,DER200H,Entrega de Monografía,10,16
Casa Central,Presencial,DER201H,Seminario de Investigación (Derecho Privado),10,16
Casa Central,Presencial,DER202H,Seminario de Investigación (Derecho Público),10,16
Casa Central,Presencial,DER203H,Seminario de Investigación (Derecho Procesal),10,16
Casa Central,Presencial,DER204H,Seminario de Investigación (Derecho Penal),10,16
Casa Central,Presencial,DER205H,Seminario de Investigación (Derecho del Trabajo),10,16
Casa Central,Presencial,DER206H,Seminario de Investigación (Fundamentos del Derecho),10,16
Casa Central,Presencial,DER301H,Clínica Jurídica I (Derecho Privado Patrimonial),10,16
Casa Central,Presencial,DER302H,Clínica Jurídica I (Derecho de Familia),10,16
Casa Central,Presencial,DER303H,Clínica Jurídica I (Derecho Público),10,16
Casa Central,Presencial,DER304H,Clínica Jurídica I (Derecho Penal),10,16
Casa Central,Presencial,DER306H,Clínica Jurídica I (Derecho del Trabajo),10,16
Casa Central,Presencial,DER401H,Clínica Jurídica II (Derecho Privado Patrimonial),10,16
Casa Central,Presencial,DER402H,Clínica Jurídica II (Derecho de Familia),10,16
Casa Central,Presencial,DER501C,Derecho de Aguas,5,16
